CREATE TABLE `t1` (
  `a` int(11) DEFAULT NULL,
  `b` char(8) NOT NULL,
  UNIQUE KEY `b` (`b`)
) ENGINE=LevelDB DEFAULT CHARSET=latin1;
INSERT INTO t1 (a,b) VALUES (1,'a'),(2,'b'),(3,'c'),(4,'d'),(5,'e'),(6,'x'),(7,'y'),(8,'z');
DELETE FROM t1 WHERE b > 'y';
DELETE FROM t1 WHERE a=2;
SELECT * FROM t1;
a	b
1	a
3	c
4	d
5	e
6	x
7	y
DELETE FROM t1;
CREATE TABLE `t1` (
  `a` int(11) NOT NULL,
  `b` char(8) DEFAULT NULL,
  PRIMARY KEY (`a`)
) ENGINE=LevelDB DEFAULT CHARSET=latin1;
INSERT INTO t1 (a,b) VALUES (1,'a'),(2,'b'),(3,'c'),(4,'d'),(5,'e'),(6,'x'),(7,'y'),(8,'z');
DELETE FROM t1 WHERE b > 'y';
DELETE FROM t1 WHERE a=2;
SELECT * FROM t1;
a	b
1	a
3	c
4	d
5	e
6	x
7	y
DELETE FROM t1;
CREATE TABLE `t1` (
  `a` int(11) NOT NULL,
  `b` int(11) DEFAULT NULL,
  `c` int(11) NOT NULL,
  UNIQUE KEY `a` (`a`)
) ENGINE=LevelDB DEFAULT CHARSET=latin1;
INSERT INTO t1 (a,b,c) VALUES (1,2,3),(4,5,6),(7,8,9);
DELETE FROM t1 WHERE a = 10 OR b = 20 ORDER BY c LIMIT 1;
SELECT * FROM t1;
a	b	c
1	2	3
4	5	6
7	8	9
